title,university,date,authors,journal,citations,theme
"A starting guide to root ecology: strengthening ecological concepts and standardising root classification, sampling, processing and trait measurements",Macquarie University,2021-10-05,Grégoire T. Freschet; Loïc Pagès; Colleen M. Iversen; Louise H. Comas; Boris Rewald,New Phytologist,463,Cybersecurity
A production recovery plan in manufacturing supply chains for a high-demand item during COVID-19,University of Technology Sydney,2020-06-19,Sanjoy Kumar Paul; Priyabrata Chowdhury,International Journal of Physical Distribution & Logistics Management,437,Cybersecurity
Improving the translation of search strategies using the Polyglot Search Translator: a randomized controlled trial,Bond University,2020-04-01,Justin Clark; Sharon Sanders; Matt Carter; David Honeyman; Gina Cleo,Journal of the Medical Library Association JMLA,428,Cybersecurity
Association Between Maternal Perinatal Depression and Anxiety and Child and Adolescent Development,Deakin University,2020-09-14,Alana Rogers; Shelley Obst; Samantha Teague; Larissa Rossen; Elizabeth Spry,JAMA Pediatrics,428,Cybersecurity
"Shaping the Metaverse into Reality: A Holistic Multidisciplinary Understanding of Opportunities, Challenges, and Avenues for Future Investigation",Curtin University,2023-02-03,Alex Koohang; Jeretta Horn Nord; Keng‐Boon Ooi; Garry Wei‐Han Tan; Mostafa Al‐Emran,Journal of Computer Information Systems,428,Cybersecurity
The Hong Kong Principles for assessing researchers: Fostering research integrity,Bond University,2020-07-16,David Moher; L.M. Bouter; Sabine Kleinert; Paul Glasziou; MH Sham,PLoS Biology,424,Cybersecurity
Updating guidance for reporting systematic reviews: development of the PRISMA 2020 statement,Monash University,2020-09-14,Matthew J. Page; Joanne E. McKenzie; Patrick M. Bossuyt; Isabelle Boutron; Tammy Hoffmann,,420,Cybersecurity
The case for early identification and intervention of chronic kidney disease: conclusions from a Kidney Disease: Improving Global Outcomes (KDIGO) Controversies Conference,Monash University,2020-10-27,Michael G. Shlipak; Sri Lekha Tummalapalli; L. Ebony Boulware; Morgan E. Grams; Joachim H. Ix,Kidney International,417,Cybersecurity
Federated Learning With Blockchain for Autonomous Vehicles: Analysis and Design Challenges,Deakin University,2020-04-27,Shiva Raj Pokhrel; Jinho Choi,IEEE Transactions on Communications,414,Cybersecurity
"Corporate ESG reporting quantity, quality and performance: Where to now for environmental policy and practice?",Macquarie University,2021-11-24,Susanne Arvidsson; John Dumay,Business Strategy and the Environment,399,Cybersecurity
COVID-19: interim guidance on rehabilitation in the hospital and post-hospital phase from a European Respiratory Society- and American Thoracic Society-coordinated international task force,Monash University,2020-08-13,Martijn A. Spruit; Anne E. Holland; Sally Singh; Thomy Tonia; Kevin C. Wilson,European Respiratory Journal,398,Cybersecurity
"Past, present, and future of customer engagement",Swinburne University of Technology,2021-11-30,Weng Marc Lim; Tareq Rasul; Satish Kumar; Mamun Ala,Journal of Business Research,391,Cybersecurity
MnO<sub>2</sub>‐Based Materials for Environmental Applications,Australian National University,2021-01-14,Ruijie Yang; Yingying Fan; Ruquan Ye; Yuxin Tang; Xiehong Cao,Advanced Materials,388,Cybersecurity
Mental health consequences of COVID-19 media coverage: the need for effective crisis communication practices,Edith Cowan University,2021-01-05,Zhaohui Su; Dean McDonnell; Jun Wen; Metin Kozak; Jaffar Abbas,Globalization and Health,387,Cybersecurity
Coronavirus (covid-19) and entrepreneurship: changing life and work landscape,La Trobe University,2020-07-21,Vanessa Ratten,Journal of Small Business & Entrepreneurship,381,Cybersecurity
Stronger policy required to substantially reduce deaths from PM2.5 pollution in China,Deakin University,2020-03-19,Huanbi Yue; Chunyang He; Qingxu Huang; Dan Yin; Brett A. Bryan,Nature Communications,373,Cybersecurity
Practical and ethical challenges of large language models in education: A systematic scoping review,Monash University,2023-08-06,Lixiang Yan; Lele Sha; Linxuan Zhao; Yuheng Li; Roberto Martínez‐Maldonado,British Journal of Educational Technology,373,Cybersecurity
Human–Autonomy Teaming: A Review and Analysis of the Empirical Literature,Curtin University,2020-10-22,Tom O’Neill; Nathan J. McNeese; Amy H. Barron; Beau G. Schelble,Human Factors The Journal of the Human Factors and Ergonomics Society,371,Cybersecurity
Mapping Internet Celebrity on TikTok: Exploring Attention Economies and Visibility Labours,Curtin University,2020-01-01,Crystal Abidin,Cultural Science Journal,366,Cybersecurity
Understanding Eco-anxiety: A Systematic Scoping Review of Current Literature and Identified Knowledge Gaps,University of New England,2021-08-01,Yumiko Coffey; Navjot Bhullar; Joanne Durkin; Md Shahidul Islam; Kim Usher,The Journal of Climate Change and Health,364,Cybersecurity
The relationship between social support and mental health problems during pregnancy: a systematic review and meta-analysis,University of Technology Sydney,2021-07-28,Asres Bedaso; Jon Adams; Wenbo Peng; David Sibbritt,Reproductive Health,357,Cybersecurity
ENMTools 1.0: an R package for comparative ecological biogeography,University of Auckland,2021-01-19,Dan L. Warren; Nicholas J. Matzke; Marcel Cardillo; John B. Baumgartner; Linda J. Beaumont,Ecography,352,Cybersecurity
Multidimensional tropical forest recovery,University of the Sunshine Coast,2021-12-09,Lourens Poorter; Dylan Craven; Catarina C. Jakovac; Masha T. van der Sande; Lucy Amissah,Science,350,Cybersecurity
Opportunities and Adoption Challenges of AI in the Construction Industry: A PRISMA Review,Queensland University of Technology,2022-03-01,Massimo Regona; Tan Yiğitcanlar; Bo Xia; Rita Yi Man Li,Journal of Open Innovation Technology Market and Complexity,350,Cybersecurity
Identifying industry 5.0 contributions to sustainable development: A strategy roadmap for delivering sustainability values,Edith Cowan University,2022-08-05,Morteza Ghobakhloo; Mohammad Iranmanesh; Muhammad Faraz Mubarak; Mobashar Mubarik; Abderahman Rejeb,Sustainable Production and Consumption,347,Cybersecurity
Mapping citizen science contributions to the UN sustainable development goals,Queensland University of Technology,2020-07-02,Dilek Fraisl; Jillian Campbell; Linda See; Uta Wehn; Joanna M. Wardlaw,Sustainability Science,346,Cybersecurity
The co-evolution of two Chinese mobile short video apps: Parallel platformization of Douyin and TikTok,Queensland University of Technology,2020-08-30,D. Bondy Valdovinos Kaye; Xu Chen; Jing Zeng,Mobile Media & Communication,345,Cybersecurity
"Nanostructured Metal Sulfides: Classification, Modification Strategy, and Solar‐Driven CO<sub>2</sub> Reduction Application",Swinburne University of Technology,2020-12-04,Jingjing Wang; Sen Lin; Na Tian; Tianyi Ma; Yihe Zhang,Advanced Functional Materials,344,Cybersecurity
2023 International Olympic Committee’s (IOC) consensus statement on Relative Energy Deficiency in Sport (REDs),Australian Catholic University,2023-09-01,Margo Mountjoy; Kathryn E. Ackerman; David M. Bailey; Louise M. Burke; Naama Constantini,British Journal of Sports Medicine,343,Cybersecurity
Viewpoint: The case for a six-dimensional food security framework,Massey University,2021-10-27,Jennifer Clapp; William G. Moseley; Barbara Burlingame; Paola Termine,Food Policy,340,Cybersecurity
Nurse resilience: A concept analysis,Curtin University,2020-03-29,Alannah L. Cooper; Janie Brown; Clare S. Rees; Gavin Leslie,International Journal of Mental Health Nursing,336,Cybersecurity
"Racism, Hate Speech, and Social Media: A Systematic Review and Critique",Queensland University of Technology,2021-01-22,Ariadna Matamoros-Fernández; Johan Farkas,Television & New Media,336,Cybersecurity
Scientific evidence on the political impact of the Sustainable Development Goals,Monash University,2022-06-20,Frank Biermann; Thomas Hickmann; Carole‐Anne Sénit; Marianne Beisheim; Steven Bernstein,Nature Sustainability,336,Cybersecurity
Global burden of antenatal depression and its association with adverse birth outcomes: an umbrella review,Flinders University,2020-02-04,Abel Fekadu Dadi; Emma R. Miller; Telake Azale Bisetegn; Lillian Mwanri,BMC Public Health,332,Cybersecurity
High-resolution mapping of losses and gains of Earth’s tidal wetlands,James Cook University,2022-05-12,Nicholas Murray; Thomas A. Worthington; Peter Bunting; Stephanie Duce; Valerie Hagger,Science,331,Cybersecurity
Are women eco‐friendly? Board gender diversity and environmental innovation,University of Otago,2020-06-29,Muhammad Nadeem; Stephen Bahadar; Ammar Ali Gull; Umer Iqbal,Business Strategy and the Environment,330,Cybersecurity
The Internet of Landlords: Digital Platforms and New Mechanisms of Rentier Capitalism,Monash University,2020-02-03,Jathan Sadowski,Antipode,328,Cybersecurity
Corporate Governance Meets Corporate Social Responsibility: Mapping the Interface,Edith Cowan University,2020-11-26,Rashid Zaman; Tanusree Jain; Georges Samara; Dima Jamali,Business & Society,326,Cybersecurity
Operationalizing the CARE and FAIR Principles for Indigenous data futures,University of Waikato,2021-04-16,Stephanie Russo Carroll; Edit Herczog; Māui Hudson; Keith Russell; Shelley Stall,Scientific Data,324,Cybersecurity
Teacher Learning in Difficult Times: Examining Foreign Language Teachers’ Cognitions About Online Teaching to Tide Over COVID-19,University of Auckland,2020-09-15,Lori Xingzhen Gao; Lawrence Jun Zhang,Frontiers in Psychology,323,Cybersecurity
"Meta‐analysis and traditional systematic literature reviews—What, why, when, where, and how?",Griffith University,2022-03-11,Justin Paul; Mojtaba Barari,Psychology and Marketing,321,Cybersecurity
Global Mangrove Extent Change 1996–2020: Global Mangrove Watch Version 3.0,James Cook University,2022-07-30,Peter Bunting; Åke Rosenqvist; Lammert Hilarides; Richard Lucas; Nathan Thomas,Remote Sensing,318,Cybersecurity
Automatic feedback in online learning environments: A systematic literature review,Monash University,2021-01-01,Anderson Pinheiro Cavalcanti; Arthur Barbosa; Ruan Carvalho; Fred Freitas; Yi‐Shan Tsai,Computers and Education Artificial Intelligence,313,Cybersecurity
Urinary extracellular vesicles: A position paper by the Urine Task Force of the International Society for Extracellular Vesicles,La Trobe University,2021-05-01,Uta Erdbrügger; Charles J. Blijdorp; Irene V. Bijnsdorp; Francesc E. Borràs; Dylan Burger,Journal of Extracellular Vesicles,310,Cybersecurity
Does board gender diversity affect renewable energy consumption?,Macquarie University,2020-06-05,Muhammad Atif; Mohammed Hossain; Md Samsul Alam; Marc Goergen,Journal of Corporate Finance,309,Cybersecurity
Screening and assessment tools for gaming disorder: A comprehensive systematic review,Flinders University,2020-02-10,Daniel L. King; Samuel R. Chamberlain; Natacha Carragher; Joël Billieux; Dan J. Stein,Clinical Psychology Review,309,Cybersecurity
Global trends in mangrove forest fragmentation,Griffith University,2020-04-28,Dale Bryan‐Brown; Rod M. Connolly; Daniel R. Richards; María Fernanda Adame; Daniel A. Friess,Scientific Reports,308,Cybersecurity
Security and privacy in 6G networks: New areas and new challenges,University of Technology Sydney,2020-07-15,Minghao Wang; Tianqing Zhu; Tao Zhang; Jun Zhang; Shui Yu,Digital Communications and Networks,303,Cybersecurity
"Modules for Experiments in Stellar Astrophysics (MESA): Time-dependent Convection, Energy Conservation, Automatic Differentiation, and Infrastructure",Monash University,2023-02-23,Adam S. Jermyn; Evan B. Bauer; Josiah Schwab; R. Farmer; Warrick H. Ball,The Astrophysical Journal Supplement Series,302,Cybersecurity
"Implementing the 27 PRISMA 2020 Statement items for systematic reviews in the sport and exercise medicine, musculoskeletal rehabilitation and sports science fields: the PERSiST (implementing Prisma in Exercise, Rehabilitation, Sport medicine and SporTs science) guidance",University of Technology Sydney,2021-10-08,Clare L. Ardern; Fionn Büttner; Renato Andrade; Adam Weir; Maureen C. Ashe,British Journal of Sports Medicine,300,Cybersecurity
"Working with Indigenous, local and scientific knowledge in assessments of nature and nature’s linkages with people",James Cook University,2020-01-15,Rosemary Hill; Çiğdem Adem; Wilfred V Alangui; Zsolt Molnár; Yildiz Aumeeruddy‐Thomas,Current Opinion in Environmental Sustainability,299,Cybersecurity
What Really Works in Special and Inclusive Education: Using Evidence-Based Teaching Strategies,University of Canterbury,2020-02-18,David Mitchell,,298,Cybersecurity
The Internet of Things (IoT) in healthcare: Taking stock and moving forward,Edith Cowan University,2023-02-14,Abderahman Rejeb; Karim Rejeb; Horst Treiblmaier; Andrea Appolloni; Salem Alghamdi,Internet of Things,296,Cybersecurity
Edge‐Rich Fe−N<sub>4</sub> Active Sites in Defective Carbon for Oxygen Reduction Catalysis,Griffith University,2020-03-05,Xin Wang; Yi Jia; Xin Mao; Daobin Liu; Wenxiang He,Advanced Materials,289,Cybersecurity
Comorbidities in SARS-CoV-2 Patients: a Systematic Review and Meta-Analysis,Griffith University,2021-02-08,Wern Hann Ng; Thomas Tipih; Makoah N. Aminake; Jan‐G Vermeulen; Dominique Goedhals,mBio,287,Cybersecurity
AMEE Consensus Statement: Planetary health and education for sustainable healthcare,Bond University,2021-02-19,Emily Shaw; Sarah Walpole; Michelle McLean; Carmen Álvarez Nieto; Stefi Barna,Medical Teacher,286,Cybersecurity
Russia–Ukraine crisis: The effects on the European stock market,Macquarie University,2022-07-09,Shaker Ahmed; Mostafa Monzur Hasan; Md Rajib Kamal,European Financial Management,280,Cybersecurity
Mission Economy: A Moonshot Guide to Changing Capitalism,University of Technology Sydney,2022-04-23,Roy Green,Contributions to Political Economy,273,Cybersecurity
COVID‐19 and Indigenous Peoples: An imperative for action,University of Technology Sydney,2020-05-16,Tamara Power; Denise Wilson; Odette Best; Teresa Brockie; Lisa Bourque Bearskin,Journal of Clinical Nursing,272,Cybersecurity
Exercise as medicine for depressive symptoms? A systematic review and meta-analysis with meta-regression,Macquarie University,2023-02-01,Andreas Heißel; Darlene Heinen; Luisa Leonie Brokmeier; Nora Skarabis; Maria Kangas,British Journal of Sports Medicine,271,Cybersecurity
Stewardship of global collective behavior,Australian Catholic University,2021-06-21,Joseph B. Bak-Coleman; Mark Alfano; Wolfram Barfuß; Carl T. Bergstrom; Miguel Ángel Centeno,Proceedings of the National Academy of Sciences,267,Cybersecurity
"Computational propaganda: political parties, politicians, and political manipulation on social media",Flinders University,2020-03-01,Emily Bienvenue,International Affairs,266,Cybersecurity
Current and Emerging Developments in Subseasonal to Decadal Prediction,Monash University,2020-01-29,William J. Merryfield; Johanna Baehr; Lauriane Batté; Emily Becker; Amy H. Butler,Bulletin of the American Meteorological Society,264,Cybersecurity
Green IoT for Eco-Friendly and Sustainable Smart Cities: Future Directions and Opportunities,Central Queensland University,2021-08-17,Faris A. Almalki; Saeed Hamood Alsamhi; Radhya Sahal; Jahan Hassan; Ammar Hawbani,Mobile Networks and Applications,263,Cybersecurity
Pandemic leadership: Lessons from New Zealand’s approach to COVID-19,Massey University,2020-05-26,Suze Wilson,Leadership,261,Cybersecurity
A systematic review on trends in using Moodle for teaching and learning,University of South Australia,2022-01-25,Sithara H. P. W. Gamage; Jennifer R. Ayres; Monica Behrend,International Journal of STEM Education,256,Cybersecurity
Missed nursing care: An overview of reviews,Griffith University,2020-10-06,Wendy Chaboyer; Emma Harbeck; Bih‐O Lee; Laurie Grealish,The Kaohsiung Journal of Medical Sciences,255,Cybersecurity
Points to consider for the treatment of immune-mediated inflammatory diseases with Janus kinase inhibitors: a consensus statement,Griffith University,2020-11-06,Peter Nash; Andreas Kerschbaumer; Thomas Dörner; Maxime Dougados; Roy Fleischmann,Annals of the Rheumatic Diseases,254,Cybersecurity
Vacancy-defect modulated pathway of photoreduction of CO2 on single atomically thin AgInP2S6 sheets into olefiant gas,University of Wollongong,2021-08-06,Wa Gao; Li Shi; Huichao He; Xiaoning Li; Zhenxiang Cheng,Nature Communications,253,Cybersecurity
Blinding and expectancy confounds in psychedelic randomized controlled trials,University of Auckland,2021-05-26,Suresh Muthukumaraswamy; Anna Forsyth; Thomas Lumley,Expert Review of Clinical Pharmacology,249,Cybersecurity
Large Language Models for Software Engineering: A Systematic Literature Review,Monash University,2024-09-20,Xinyi Hou; Yanjie Zhao; Yue Liu; Zhou Yang; Kailong Wang,ACM Transactions on Software Engineering and Methodology,249,Cybersecurity
A community-based transcriptomics classification and nomenclature of neocortical cell types,Macquarie University,2020-08-24,Rafael Yuste; Michael Hawrylycz; Nadia Aalling; Argel Aguilar‐Valles; Detlev Arendt,Nature Neuroscience,248,Cybersecurity
"Agriculture Development, Pesticide Application and Its Impact on the Environment",Griffith University,2021-01-27,Muyesaier Tudi; Huada Daniel Ruan; Li Wang; Jia Lyu; Ross Sadler,International Journal of Environmental Research and Public Health,1963,Energy_Sustainability
Earth beyond six of nine planetary boundaries,Australian National University,2023-09-13,Katherine Richardson; Will Steffen; Wolfgang Lucht; Jørgen Bendtsen; Sarah Cornell,Science Advances,1748,Energy_Sustainability
Airborne transmission of SARS-CoV-2: The world should face the reality,Queensland University of Technology,2020-04-10,Lídia Morawska; Junji Cao,Environment International,1741,Energy_Sustainability
Plant responses to rising vapor pressure deficit,James Cook University,2020-02-17,Charlotte Grossiord; Thomas N. Buckley; Lucas A. Cernusak; Kimberly A. Novick; Benjamin Poulter,New Phytologist,1601,Energy_Sustainability
Phytoremediation: A Promising Approach for Revegetation of Heavy Metal-Polluted Land,University of New England,2020-04-30,Yan An; Yamin Wang; Swee Ngin Tan; Mohamed Lokman Mohd Yusof; Subhadip Ghosh,Frontiers in Plant Science,1367,Energy_Sustainability
Global threat of arsenic in groundwater,University of Southern Queensland,2020-05-21,Joel Podgorski; Michael Berg,Science,1223,Energy_Sustainability
Pharmaceutical pollution of the world’s rivers,Deakin University,2022-02-14,John L. Wilkinson; Alistair B.A. Boxall; Dana W. Kolpin; Kmy Leung; Racliffe Weng Seng Lai,Proceedings of the National Academy of Sciences,1149,Energy_Sustainability
Bending the Curve of Global Freshwater Biodiversity Loss: An Emergency Recovery Plan,Griffith University,2020-01-09,David Tickner; Jeffrey J. Opperman; Robin Abell; Mike Acreman; Angela H. Arthington,BioScience,962,Energy_Sustainability
Safe and just Earth system boundaries,Australian National University,2023-05-31,Johan Rockström; Joyeeta Gupta; Dahe Qin; Steven J. Lade; Jesse F. Abrams,Nature,833,Energy_Sustainability
Trade-offs between multifunctionality and profit in tropical smallholder landscapes,University of Waikato,2020-03-04,Ingo Graß; Christoph Kubitza; Vijesh V. Krishna; Marife D. Corre; Oliver Mußhoff,Nature Communications,769,Energy_Sustainability
Estimation of airborne viral emission: Quanta emission rate of SARS-CoV-2 for infection risk assessment,Queensland University of Technology,2020-05-11,Giorgio Buonanno; Luca Stabile; Lídia Morawska,Environment International,740,Energy_Sustainability
"Progress in biomass torrefaction: Principles, applications and challenges",University of Technology Sydney,2020-10-26,Wei‐Hsin Chen; Bo-Jhih Lin; Yu‐Ying Lin; Yen-Shih Chu; Aristotle T. Ubando,Progress in Energy and Combustion Science,738,Energy_Sustainability
"Forest microclimates and climate change: Importance, drivers and future research agenda",University of Wollongong,2021-03-16,Pieter De Frenne; Jonathan Lenoir; Miska Luoto; Brett R. Scheffers; Florian Zellweger,Global Change Biology,736,Energy_Sustainability
County-level CO2 emissions and sequestration in China during 1997–2017,Curtin University,2020-11-12,Jiandong Chen; Ming Gao; Shulei Cheng; Wenxuan Hou; Malin Song,Scientific Data,713,Energy_Sustainability
Hanging by a thread? Forests and drought,University of Tasmania,2020-04-16,Timothy J. Brodribb; Jennifer S. Powers; Hervé Cochard; Brendan Choat,Science,698,Energy_Sustainability
The soundscape of the Anthropocene ocean,La Trobe University,2021-02-04,Carlos M. Duarte; Lucille Chapuis; Shaun P. Collin; Daniel P. Costa; Reny P. Devassy,Science,679,Energy_Sustainability
Fertilizers and nitrate pollution of surface and ground water: an increasingly pervasive global problem,Australian National University,2021-03-31,Bijay Sıngh; E. T. Craswell,SN Applied Sciences,663,Energy_Sustainability
"Global, regional, and national burden of mortality associated with non-optimal ambient temperatures from 2000 to 2019: a three-stage modelling study",Monash University,2021-07-01,Qi Zhao; Yuming Guo; Tingting Ye; Antonio Gasparrini; Shilu Tong,The Lancet Planetary Health,651,Energy_Sustainability
Global meta-analysis shows pervasive phosphorus limitation of aboveground plant production in natural terrestrial ecosystems,Griffith University,2020-01-31,Enqing Hou; Yiqi Luo; Yuanwen Kuang; Chengrong Chen; X. L. Lu,Nature Communications,615,Energy_Sustainability
A critical review on advances in the practices and perspectives for the treatment of dye industry wastewater,University of Technology Sydney,2020-12-28,Toral Shindhal; Parita Rakholiya; Sunita Varjani; Ashok Pandey; Huu Hao Ngo,Bioengineered,591,Energy_Sustainability
"Coral restoration – A systematic review of current methods, successes, failures and future directions",James Cook University,2020-01-30,Lisa Boström‐Einarsson; Russell C. Babcock; Elisa Bayraktarov; Daniela M. Ceccarelli; Nathan Cook,PLoS ONE,575,Energy_Sustainability
Ongoing declines for the world’s amphibians in the face of emerging threats,James Cook University,2023-10-04,Jennifer Luedtke; Janice Chanson; Kelsey Neam; Louise Hobin; Adriano Oliveira Maciel,Nature,470,Energy_Sustainability
Chromium Bioaccumulation and Its Impacts on Plants: An Overview,University of Tasmania,2020-01-13,Anket Sharma; Dhriti Kapoor; Junfeng Wang; Babar Shahzad; Vinod Kumar,Plants,444,Energy_Sustainability
Seamless retrievals of chlorophyll-a from Sentinel-2 (MSI) and Sentinel-3 (OLCI) in inland and coastal waters: A machine-learning approach,University of Waikato,2020-02-07,Nima Pahlevan; Brandon Smith; John F. Schalles; Caren Binding; Zhigang Cao,Remote Sensing of Environment,427,Energy_Sustainability
Extreme weather impacts of climate change: an attribution perspective,Victoria University of Wellington,2022-06-28,Ben Clarke; Friederike E. L. Otto; Rupert Stuart-Smith; Luke J. Harrington,Environmental Research Climate,424,Energy_Sustainability
Scientists' warning on climate change and insects,Monash University,2022-11-07,Jeffrey A. Harvey; Kévin Tougeron; Rieta Gols; Robin Heinen; Mariana Abarca,Ecological Monographs,411,Energy_Sustainability
Indoor Exposure to Selected Air Pollutants in the Home Environment: A Systematic Review,Australian National University,2020-12-02,Sotiris Vardoulakis; Evanthia Giagloglou; Susanne Steinle; Alice Davis; Anne Sleeuwenhoek,International Journal of Environmental Research and Public Health,403,Energy_Sustainability
Perceived global increase in algal blooms is attributable to intensified monitoring and emerging bloom impacts,University of Tasmania,2021-06-08,Gustaaf M. Hallegraeff; Donald M. Anderson; Catherine Belin; Marie‐Yasmine Dechraoui Bottein; Eileen Bresnan,Communications Earth & Environment,397,Energy_Sustainability
Sampling biases shape our view of the natural world,University of Auckland,2021-06-21,Alice C. Hughes; Michael C. Orr; Keping Ma; Mark J. Costello; John Waller,Ecography,396,Energy_Sustainability
Making sustainable aluminum by recycling scrap: The science of “dirty” alloys,Monash University,2022-04-07,Dierk Raabe; Dirk Ponge; Peter J. Uggowitzer; Moritz Roscher; Mario Paolantonio,Progress in Materials Science,396,Energy_Sustainability
Climate Change Risks to Global Forest Health: Emergence of Unexpected Events of Elevated Tree Mortality Worldwide,Murdoch University,2022-03-01,Henrik Hartmann; Ana Bastos; Adrian J. Das; Adriane Esquivel‐Muelbert; William M. Hammond,Annual Review of Plant Biology,393,Energy_Sustainability
The MPA Guide: A framework to achieve global goals for the ocean,James Cook University,2021-09-09,Kirsten Grorud‐Colvert; Jenna Sullivan‐Stack; Callum M. Roberts; Vanessa Constant; Bárbara Horta e Costa,Science,392,Energy_Sustainability
On the History and Future of 100% Renewable Energy Systems Research,University of Technology Sydney,2022-01-01,Christian Breyer; Siavash Khalili; Dmitrii Bogdanov; Manish Ram; Ayobami Solomon Oyewo,IEEE Access,377,Energy_Sustainability
Towards a unified study of multiple stressors: divisions and common goals across research disciplines,University of Otago,2020-05-06,James Orr; Rolf D. Vinebrooke; Michelle C. Jackson; Kristy J. Kroeker; Rebecca L. Kordas,Proceedings of the Royal Society B Biological Sciences,372,Energy_Sustainability
Plastic ingestion as an evolutionary trap: Toward a holistic understanding,Massey University,2021-07-01,Robson G. Santos; Gabriel E. Machovsky‐Capuska; Ryan Andrades,Science,372,Energy_Sustainability
