title,university,date,authors,journal,citations,theme
Deep Learning Approaches Applied to Remote Sensing Datasets for Road Extraction: A State-Of-The-Art Review,University of Technology Sydney,2020-05-02,Abolfazl Abdollahi; Biswajeet Pradhan; Nagesh Shukla; Subrata Chakraborty; Abdullah Alamri,Remote Sensing,243,AI_Machine_Learning
Storm impacts on phytoplankton community dynamics in lakes,Griffith University,2020-03-05,Jason D. Stockwell; Jonathan P. Doubek; Rita Adrian; Orlane Anneville; Cayelan C. Carey,Global Change Biology,242,AI_Machine_Learning
Privacy-Aware Data Fusion and Prediction With Spatial-Temporal Context for Smart City Industrial Environment,Macquarie University,2020-07-28,Lianyong Qi; Chunhua Hu; Xuyun Zhang; Mohammad R. Khosravi; Suraj Sharma,IEEE Transactions on Industrial Informatics,242,AI_Machine_Learning
Framing the FRAM: A literature review on the functional resonance analysis method,Macquarie University,2020-05-22,Riccardo Patriarca; Giulio Di Gravio; Rogier Woltjer; Francesco Costantino; Gesa Praetorius,Safety Science,241,AI_Machine_Learning
Machine learning uncovers the most robust self-report predictors of relationship quality across 43 longitudinal couples studies,Victoria University of Wellington,2020-07-27,Samantha Joel; Paul W. Eastwick; Colleen J. Allison; Ximena B. Arriaga; Zachary G. Baker,Proceedings of the National Academy of Sciences,241,AI_Machine_Learning
Hierarchical Adversarial Attacks Against Graph-Neural-Network-Based IoT Network Intrusion Detection System,University of Auckland,2021-11-24,Xiaokang Zhou; Wei Liang; Weimin Li; Ke Yan; Shohei Shimizu,IEEE Internet of Things Journal,241,AI_Machine_Learning
Distributed Observer-Based Cooperative Control Approach for Uncertain Nonlinear MASs Under Event-Triggered Communication,Swinburne University of Technology,2021-06-21,Chao Deng; Changyun Wen; Jiangshuai Huang; Xian‐Ming Zhang; Ying Zou,IEEE Transactions on Automatic Control,239,AI_Machine_Learning
Discourses of artificial intelligence in higher education: a critical literature review,Deakin University,2022-10-24,Margaret Bearman; Juliana Ryan; Rola Ajjawi,Higher Education,239,AI_Machine_Learning
Automated Pavement Crack Segmentation Using U-Net-Based Convolutional Neural Network,Monash University,2020-01-01,Stephen Lau; Edwin K. P. Chong; Xu Yang; Xin Wang,IEEE Access,236,AI_Machine_Learning
A reflection on polymer electrolytes for solid-state lithium metal batteries,Deakin University,2023-08-12,Ziyu Song; Fangfang Chen; María Martínez‐Ibáñez; Wenfang Feng; Maria Forsyth,Nature Communications,236,AI_Machine_Learning
Coronavirus (Covid-19) and the entrepreneurship education community,La Trobe University,2020-08-11,Vanessa Ratten,Journal of Enterprising Communities People and Places in the Global Economy,235,AI_Machine_Learning
Abusive supervision: A systematic review and fundamental rethink,Curtin University,2021-06-25,Thomas Fischer; Amy Wei Tian; Allan Lee; David J. Hughes,The Leadership Quarterly,235,AI_Machine_Learning
Advancing Image Understanding in Poor Visibility Environments: A Collective Benchmark Study,Australian National University,2020-01-01,Wenhan Yang; Ye Yuan; Wenqi Ren; Jiaying Liu; Walter J. Scheirer,IEEE Transactions on Image Processing,234,AI_Machine_Learning
Assessment in the age of artificial intelligence,Monash University,2022-01-01,Zachari Swiecki; Hassan Khosravi; Guanliang Chen; Roberto Martínez‐Maldonado; Jason M. Lodge,Computers and Education Artificial Intelligence,234,AI_Machine_Learning
The three numbers you need to know about healthcare: the 60-30-10 Challenge,Macquarie University,2020-05-04,Jeffrey Braithwaite; Paul Glasziou; Johanna Westbrook,BMC Medicine,233,AI_Machine_Learning
A brief-review of the risk factors for covid-19 severity,Queensland University of Technology,2020-07-10,J.E. Rod; Óscar Oviedo-Trespalacios; Javier Cortés-Ramírez,Revista de Saúde Pública,233,AI_Machine_Learning
Learning Filter Pruning Criteria for Deep Convolutional Neural Networks Acceleration,University of Technology Sydney,2020-06-01,Yang He; Yuhang Ding; Ping Liu; Linchao Zhu; Hanwang Zhang,2022 IEEE/CVF Conference on Computer Vision and Pattern Recognition (CVPR),233,AI_Machine_Learning
Artificial intelligence: a systematic review of methods and applications in hospitality and tourism,University of Auckland,2021-12-23,Zohreh Doborjeh; Nigel Hemmington; Maryam Doborjeh; Nikola Kasabov,International Journal of Contemporary Hospitality Management,233,AI_Machine_Learning
"Explainable, trustworthy, and ethical machine learning for healthcare: A survey",Monash University,2022-09-07,Khansa Rasheed; Adnan Qayyum; Mohammed Ghaly; Ala Al‐Fuqaha; Adeel Razi,Computers in Biology and Medicine,233,AI_Machine_Learning
Transforming knowledge systems for life on Earth: Visions of future systems and how to get there,University of Technology Sydney,2020-09-25,Ioan Fazey; Niko Schäpke; Guido Caniglia; Anthony Hodgson; Ian Kendrick,Energy Research & Social Science,232,AI_Machine_Learning
Investigating the mediating role of visitor satisfaction in the relationship between memorable tourism experiences and behavioral intentions in heritage tourism context,University of Canterbury,2021-08-11,S. Mostafa Rasoolimanesh; Siamak Seyfi; Raouf Ahmad Rather; C. Michael Hall,Tourism Review,232,AI_Machine_Learning
Boosting the Development of Hard Carbon for Sodium‐Ion Batteries: Strategies to Optimize the Initial Coulombic Efficiency,University of Wollongong,2023-05-26,Yunrui Yang; Chun Wu; Xiang‐Xi He; Jiahua Zhao; Zhuo Yang,Advanced Functional Materials,232,AI_Machine_Learning
Self-Supervised Learning for Recommender Systems: A Survey,Queensland University of Technology,2023-06-05,Junliang Yu; Hongzhi Yin; Xin Xia; Tong Chen; Jundong Li,IEEE Transactions on Knowledge and Data Engineering,231,AI_Machine_Learning
Sensor data quality: a systematic review,University of Auckland,2020-02-11,Hui Yie Teh; Andreas W. Kempa-Liehr; Kevin I‐Kai Wang,Journal Of Big Data,230,AI_Machine_Learning
Foundations and Modeling of Dynamic Networks Using Dynamic Graph Neural Networks: A Survey,University of Technology Sydney,2021-01-01,Joakim Skarding; Bogdan Gabryś; Katarzyna Musiał,IEEE Access,230,AI_Machine_Learning
Attribute-Based Encryption With Parallel Outsourced Decryption for Edge Intelligent IoV,Charles Darwin University,2020-09-29,Chaosheng Feng; Keping Yu; Moayad Aloqaily; Mamoun Alazab; Zhihan Lv,IEEE Transactions on Vehicular Technology,230,AI_Machine_Learning
A review on COVID-19 forecasting models,University of Technology Sydney,2021-02-04,Iman Rahimi; Chen Fang; Amir H. Gandomi,Neural Computing and Applications,230,AI_Machine_Learning
Contrastive Learning based Hybrid Networks for Long-Tailed Image Classification,University of Wollongong,2021-06-01,Peng Wang; Kai Han; Xiu-Shen Wei; Lei Zhang; Lei Wang,2022 IEEE/CVF Conference on Computer Vision and Pattern Recognition (CVPR),230,AI_Machine_Learning
Portable Food‐Freshness Prediction Platform Based on Colorimetric Barcode Combinatorics and Deep Convolutional Neural Networks,Monash University,2020-10-01,Lingling Guo; Ting Wang; Zhonghua Wu; Jianwu Wang; Ming Wang,Advanced Materials,229,AI_Machine_Learning
Video Improves Learning in Higher Education: A Systematic Review,Australian Catholic University,2021-02-16,Michael Noetel; Shantell Griffith; Oscar Delaney; Taren Sanders; Philip D. Parker,Review of Educational Research,229,AI_Machine_Learning
Knowledge Tracing: A Survey,Australian National University,2022-10-26,Ghodai Abdelrahman; Qing Wang; Bernardo Pereira Nunes,ACM Computing Surveys,229,AI_Machine_Learning
Autoencoders and their applications in machine learning: a survey,Queensland University of Technology,2024-02-03,Kamal Berahmand; Fatemeh Daneshfar; Elaheh Sadat Salehi; Yuefeng Li; Yue Xu,Artificial Intelligence Review,229,AI_Machine_Learning
Ecosystems monitoring powered by environmental genomics: A review of current strategies with an implementation roadmap,Macquarie University,2020-05-16,Tristan Cordier; Laura Alonso‐Sáez; Laure Apothéloz‐Perret‐Gentil; Eva Aylagas; David A. Bohan,Molecular Ecology,228,AI_Machine_Learning
Applications of optical microcombs,Swinburne University of Technology,2022-11-09,Yang Sun; Jiayang Wu; Mengxi Tan; Xingyuan Xu; Yang Li,Advances in Optics and Photonics,228,AI_Machine_Learning
"Deep Learning for Community Detection: Progress, Challenges and Opportunities",Macquarie University,2020-07-01,Fanzhen Liu; Shan Xue; Jia Wu; Chuan Zhou; Wenbin Hu,,227,AI_Machine_Learning
Detecting Code Clones with Graph Neural Network and Flow-Augmented Abstract Syntax Tree,Monash University,2020-02-01,Wenhan Wang; Ge Li; Bo Ma; Xin Xia; Zhi Jin,,226,AI_Machine_Learning
Novel Transfer Learning Approach for Medical Imaging with Limited Labeled Data,Queensland University of Technology,2021-03-30,Laith Alzubaidi; Muthana Al‐Amidie; Ahmed Al‐Asadi; Amjad J. Humaidi; Omran Al-Shamma,Cancers,226,AI_Machine_Learning
The ARRIVE guidelines 2.0: updated guidelines for reporting animal researchThe ARRIVE guidelines 2.0: updated guidelines for reporting animal research,University of Tasmania,2020-07-01,Nathalie Percie du Sert; Viki Hurst; Amrita Ahluwalia; Sabina Alam; Marc T. Avey,BMJ Open Science,226,AI_Machine_Learning
Federated learning enables big data for rare cancer boundary detection,Flinders University,2022-12-05,Sarthak Pati; Ujjwal Baid; Brandon Edwards; Micah Sheller; Shih‐Han Wang,Nature Communications,226,AI_Machine_Learning
Brain States and Transitions: Insights from Computational Neuroscience,Monash University,2020-09-01,Morten L. Kringelbach; Gustavo Deco,Cell Reports,225,AI_Machine_Learning
GMFlow: Learning Optical Flow via Global Matching,Monash University,2022-06-01,Haofei Xu; Jing Zhang; Jianfei Cai; Hamid Rezatofighi; Dacheng Tao,2022 IEEE/CVF Conference on Computer Vision and Pattern Recognition (CVPR),224,AI_Machine_Learning
"Development and Reporting of Prediction Models: Guidance for Authors From Editors of Respiratory, Sleep, and Critical Care Journals",Monash University,2020-03-06,Daniel E. Leisman; Michael O. Harhay; David J. Lederer; Michael J. Abramson; Alex A. Adjei,Critical Care Medicine,223,AI_Machine_Learning
The Lancet Series call to action to reduce low value care for low back pain: an update,Monash University,2020-08-15,Rachelle Buchbinder; Martin Underwood; Jan Hartvigsen; Christopher G. Maher,Pain,222,AI_Machine_Learning
Virtual and Augmented Reality Enhancements to Medical and Science Student Physiology and Anatomy Test Performance: A Systematic Review and Meta‐Analysis,Bond University,2020-12-31,Christian Moro; James Birt; Zane Štromberga; Charlotte Phelps; Justin Clark,Anatomical Sciences Education,222,AI_Machine_Learning
Two-Layer Federated Learning With Heterogeneous Model Aggregation for 6G Supported Internet of Vehicles,University of Auckland,2021-05-06,Xiaokang Zhou; Wei Liang; Jinhua She; Zheng Yan; Kevin I‐Kai Wang,IEEE Transactions on Vehicular Technology,222,AI_Machine_Learning
Hierarchical Conditional Relation Networks for Video Question Answering,Deakin University,2020-06-01,Thao Minh Le; Vuong Le; Svetha Venkatesh; Truyen Tran,2022 IEEE/CVF Conference on Computer Vision and Pattern Recognition (CVPR),221,AI_Machine_Learning
"Cancer Incidence, Mortality, Years of Life Lost, Years Lived With Disability, and Disability-Adjusted Life Years for 29 Cancer Groups From 2010 to 2019",Auckland University of Technology,2021-12-30,Jonathan Kocarnik; Kelly Compton; Frances Dean; Weijia Fu; Brian Gaw,JAMA Oncology,1527,Defense_Security
"Assessing the age specificity of infection fatality rates for COVID-19: systematic review, meta-analysis, and public policy implications",University of Wollongong,2020-12-01,Andrew Levin; William P. Hanage; Nana Owusu‐Boaitey; Kensington Cochran; Seamus P. Walsh,European Journal of Epidemiology,832,Defense_Security
The prevalence of mental illness in refugees and asylum seekers: A systematic review and meta-analysis,Monash University,2020-09-21,Rebecca Blackmore; Jacqueline Boyle; Mina Fazel; Sanjeeva Ranasinha; Kylie M. Gray,PLoS Medicine,702,Defense_Security
"Global, Regional and Country-Specific Burden of Ischaemic Stroke, Intracerebral Haemorrhage and Subarachnoid Haemorrhage: A Systematic Analysis of the Global Burden of Disease Study 2017",Auckland University of Technology,2020-01-01,Rita Krishnamurthi; Takayoshi Ikeda; Valery L. Feigin,Neuroepidemiology,640,Defense_Security
Projecting the continental accumulation of alien species through to 2050,Lincoln University,2020-10-01,Hanno Seebens; Sven Bacher; Tim M. Blackburn; César Capinha; Wayne Dawson,Global Change Biology,609,Defense_Security
Genetic diversity targets and indicators in the CBD post-2020 Global Biodiversity Framework must be improved,Flinders University,2020-07-02,Sean Hoban; Michael W. Bruford; Josephine D’Urban Jackson; Margarida Lopes-Fernandes; Myriam Heuertz,Biological Conservation,505,Defense_Security
Online Health Information Seeking Behavior: A Systematic Review,Massey University,2021-12-16,Xiaoyun Jia; Yan Pang; Liangni Sally Liu,Healthcare,344,Defense_Security
Mental health in the UK during the COVID-19 pandemic: cross-sectional analyses from a community cohort study,University of Auckland,2020-09-01,Ru Jia; Kieran Ayling; Trudie Chalder; Adam Massey; Elizabeth Broadbent,BMJ Open,322,Defense_Security
Estimated global cancer incidence in the oldest adults in 2018 and projections to 2050,University of Otago,2020-07-24,Sophie Pilleron; Enrique Soto‐Pérez‐de‐Celis; Jérôme Vignat; Jacques Ferlay; Isabelle Soerjomataram,International Journal of Cancer,308,Defense_Security
PHANGS–ALMA: Arcsecond CO(2–1) Imaging of Nearby Star-forming Galaxies,Australian National University,2021-11-24,Adam K. Leroy; E. Schinnerer; Annie Hughes; Erik Rosolowsky; J. Pety,The Astrophysical Journal Supplement Series,281,Defense_Security
Extraordinary human energy consumption and resultant geological impacts beginning around 1950 CE initiated the proposed Anthropocene Epoch,Australian National University,2020-10-16,James P. M. Syvitski; Colin N. Waters; John W. Day; John D. Milliman; Colin Summerhayes,Communications Earth & Environment,276,Defense_Security
Scientists’ warning – The outstanding biodiversity of islands is in peril,Victoria University of Wellington,2021-09-28,José María Fernández‐Palacios; Holger Kreft; Severin D. H. Irl; Sietze J. Norder; Claudine Ah‐Peng,Global Ecology and Conservation,271,Defense_Security
"Racial disparities in COVID-19 pandemic cases, hospitalisations, and deaths: A systematic review and meta-analysis",Central Queensland University,2021-06-26,William Mude; Victor M. Oguoma; Tafadzwa Nyanhanda; Lillian Mwanri; Carolyne Njue,Journal of Global Health,245,Defense_Security
"Assessing preventive health behaviors from COVID-19: a cross sectional study with health belief model in Golestan Province, Northern of Iran",University of Tasmania,2020-11-17,Hossein Shahnazi; Maryam Ahmadi-Livani; Bagher Pahlavanzadeh; Abdolhalim Rajabi; Mohammad Shoaib Hamrah,Infectious Diseases of Poverty,240,Defense_Security
"Plant growth-promoting microorganisms as biocontrol agents of plant diseases: Mechanisms, challenges and future perspectives",Murdoch University,2022-10-06,Mohamed T. El‐Saadony; Ahmed M. Saad; Soliman M. Soliman; Heba M. Salem; Alshaymaa I. Ahmed,Frontiers in Plant Science,237,Defense_Security
Short term association between ozone and mortality: global two stage time series study in 406 locations in 20 countries,Monash University,2020-02-10,Ana M. Vicedo‐Cabrera; Francesco Sera; Cong Liu; Ben Armstrong; Ai Milojevic,BMJ,222,Defense_Security
"The impacts of knowledge, risk perception, emotion and information on citizens’ protective behaviors during the outbreak of COVID-19: a cross-sectional study in China",La Trobe University,2020-11-23,Liangwen Ning; Jinyu Niu; Xuejing Bi; Chao Yang; Ze Liu,BMC Public Health,221,Defense_Security
Antenatal depression and its association with adverse birth outcomes in low and middle-income countries: A systematic review and meta-analysis,Flinders University,2020-01-10,Abel Fekadu Dadi; Emma R. Miller; Lillian Mwanri,PLoS ONE,205,Defense_Security
A global outlook to the interruption of education due to COVID-19 pandemic: Navigating in a time of uncertainty and crisis,Deakin University,2020-06-06,Aras Bozkurt; Insung Jung; Junhong Xiao; Viviane Vladimirschi; Robert Schuwer,,203,Defense_Security
"Short term associations of ambient nitrogen dioxide with daily total, cardiovascular, and respiratory mortality: multilocation analysis in 398 cities",Monash University,2021-03-24,Xia Meng; Cong Liu; Renjie Chen; Francesco Sera; Ana María Vicedo-Cabrera,BMJ,203,Defense_Security
The origin of spin in binary black holes,Monash University,2020-01-24,Simone S. Bavera; Tassos Fragos; Ying Qin; Emmanouil Zapartas; Coenraad J. Neijssel,Astronomy and Astrophysics,201,Defense_Security
Intelligent robots for fruit harvesting: recent developments and future challenges,Monash University,2022-06-02,Hongyu Zhou; Xing Wang; Wesley Au; Hanwen Kang; Chao Chen,Precision Agriculture,200,Defense_Security
"“<i>We aren't your reincarnation!</i>” workplace motivation across X, Y and Z generations",Monash University,2020-06-17,Ali B. Mahmoud; Leonora Fuxman; Iris Mohr; William D. Reisel; Nicholas Grigoriou,International Journal of Manpower,197,Defense_Security
"Severe COVID-19 outcomes after full vaccination of primary schedule and initial boosters: pooled analysis of national prospective cohort studies of 30 million individuals in England, Northern Ireland, Scotland, and Wales",Victoria University of Wellington,2022-10-01,Utkarsh Agrawal; Stuart Bedston; Colin McCowan; Jason Oke; Lynsey Patterson,The Lancet,190,Defense_Security
The global prevalence and trend of human intestinal carriage of ESBL-producing <i>Escherichia coli</i> in the community,University of Tasmania,2020-09-09,Yihienew Mequanint Bezabih; Wilber Sabiiti; Endalkachew Alamneh; Alamneh Bezabih; Gregory M. Peterson,Journal of Antimicrobial Chemotherapy,188,Defense_Security
"Biology, invasion and management of the agricultural invader: Fall armyworm, Spodoptera frugiperda (Lepidoptera: Noctuidae)",Murdoch University,2021-02-16,Jing Wan; Cong Huang; Changyou Li; Hongxu Zhou; Yonglin Ren,Journal of Integrative Agriculture,182,Defense_Security
Population vs Individual Prediction of Poor Health From Results of Adverse Childhood Experiences Screening,University of Otago,2021-01-26,Jessie R. Baldwin; Avshalom Caspi; Alan J. Meehan; Antony Ambler; Louise Arseneault,JAMA Pediatrics,178,Defense_Security
Four priority areas to advance invasion science in the face of rapid environmental change,Lincoln University,2020-12-07,Anthony Ricciardi; Josephine C. Iacarella; David C. Aldridge; Tim M. Blackburn; James T. Carlton,Environmental Reviews,177,Defense_Security
Energy-Aware Marine Predators Algorithm for Task Scheduling in IoT-Based Fog Computing Applications,Macquarie University,2020-06-11,Mohamed Abdel‐Basset; Reda Mohamed; Mohamed Elhoseny; Ali Kashif Bashir; Alireza Jolfaei,IEEE Transactions on Industrial Informatics,175,Defense_Security
Effects of undernutrition on mortality and morbidity among adults living with HIV in sub-Saharan Africa: a systematic review and meta-analysis,University of Technology Sydney,2021-01-04,Animut Alebel; Daniel Demant; Pammla Petrucka; David Sibbritt,BMC Infectious Diseases,173,Defense_Security
Forced Migration and Human Capital: Evidence from Post-WWII Population Transfers,Monash University,2020-04-28,Sascha O. Becker; Irena Grosfeld; Pauline Grosjean; Nico Voigtländer; Ekaterina Zhuravskaya,American Economic Review,166,Defense_Security
"Internet Use, Sustainable Agricultural Practices and Rural Incomes: Evidence from China",Lincoln University,2020-07-22,Wanglin Ma; Xiaobing Wang,Australian Journal of Agricultural and Resource Economics,165,Defense_Security
Prevalence of Internet Addiction and Gaming Disorders in Southeast Asia: A Meta-Analysis,University of Waikato,2020-04-09,Doris Xin Yi Chia; Charis Wei Ling Ng; Gomathinayagam Kandasami; Mavis Y. L. Seow; Carol C. Choo,International Journal of Environmental Research and Public Health,159,Defense_Security
Fear of COVID‐19 Scale (FCV‐19S) across countries: Measurement invariance issues,University of Otago,2021-03-21,Chung‐Ying Lin; Wen‐Li Hou; Mohammed A. Mamun; José Aparecido Da Silva; Yunier Broche‐Pérez,Nursing Open,154,Defense_Security
"The impact of COVID-19 lockdown on snacking habits, fast-food and alcohol consumption: A systematic review of the evidence",Queensland University of Technology,2021-04-17,Dimitra Rafailia Bakaloudi; Dhanushya T. Jeyakumar; Ranil Jayawardena; Michail Chourdakis,Clinical Nutrition,154,Defense_Security
Ultraprocessed food consumption and dietary nutrient profiles associated with obesity: A multicountry study of children and adolescents,Deakin University,2021-12-09,Daniela Neri; Eurídice Martínez Steele; Neha Khandpur; Gustavo Cediel; María Elisa Zapata,Obesity Reviews,154,Defense_Security
Overfishing and habitat loss drive range contraction of iconic marine fishes to near extinction,Charles Darwin University,2021-02-10,Helen F. Yan; Peter M. Kyne; Rima W. Jabado; Ruth H. Leeney; Lindsay N. K. Davidson,Science Advances,151,Defense_Security
Blood lead levels in low-income and middle-income countries: a systematic review,Macquarie University,2021-03-01,Bret Ericson; Howard Hu; Emily Nash; Gregory L. Ferraro; Julia Sinitsky,The Lancet Planetary Health,139,Defense_Security
Automated Deep CNN-LSTM Architecture Design for Solar Irradiance Forecasting,Deakin University,2021-07-12,Seyed Mohammad Jafar Jalali; Sajad Ahmadian; Abdollah Kavousi‐Fard; Abbas Khosravi; Saeid Nahavandi,IEEE Transactions on Systems Man and Cybernetics Systems,137,Defense_Security
Why food insecurity persists in sub-Saharan Africa: A review of existing evidence,University of South Australia,2022-02-03,Vibeke Bjornlund; Henning Bjørnlund; André van Rooyen,Food Security,135,Defense_Security
Large Interferometer For Exoplanets (LIFE),Australian National University,2022-04-12,Sascha P. Quanz; Maurice Ottiger; E. Fontanet; Jens Kammerer; Franziska Menti,Astronomy and Astrophysics,132,Defense_Security
Marine mammal conservation: over the horizon,Deakin University,2021-01-28,Sarah E. Nelms; Joanna Alfaro‐Shigueto; JPY Arnould; Isabel Cristina Ávila; Susan Bengtson Nash,Endangered Species Research,125,Defense_Security
Factors affecting success of conservation translocations of terrestrial vertebrates: A global systematic review,University of Tasmania,2021-05-12,Shane D. Morris; Barry W. Brook; Katherine E. Moseby; Christopher N. Johnson,Global Ecology and Conservation,125,Defense_Security
Association of Healthful Plant-based Diet Adherence With Risk of Mortality and Major Chronic Diseases Among Adults in the UK,Edith Cowan University,2023-03-28,Alysha S. Thompson; Anna Tresserra‐Rimbau; Nena Karavasiloglou; Amy Jennings; Marie M. Cantwell,JAMA Network Open,125,Defense_Security
Assessment of COVID-19 Information Overload Among the General Public,University of Tasmania,2021-01-19,Mustapha Mohammed; Abubakar Sha’aban; Abubakar Ibrahim Jatau; Ismaeel Yunusa; Abubakar Isa,Journal of Racial and Ethnic Health Disparities,123,Defense_Security
Prevalence of first adolescent pregnancy and its associated factors in sub-Saharan Africa: A multi-country analysis,University of Technology Sydney,2021-02-04,Bright Opoku Ahinkorah; Melissa Kang; Lin Perry; Fiona Brooks; Andrew Hayen,PLoS ONE,120,Defense_Security
Epidemiology of injuries in male and female youth football players: A systematic review and meta-analysis,Auckland University of Technology,2021-10-25,Francisco Javier Robles-Palazón; Alejandro López‐Valenciano; Mark De Ste Croix; Jon L. Oliver; José Alberto García,Journal of sport and health science/Journal of Sport and Health Science,116,Defense_Security
Effect of lockdown on mental health in Australia: evidence from a natural experiment analysing a longitudinal probability sample survey,Australian National University,2022-04-21,Peter Butterworth; Stefanie Schurer; Trong‐Anh Trinh; Esperanza Vera‐Toscano; Mark Wooden,The Lancet Public Health,112,Defense_Security
A Review on Constraint Handling Techniques for Population-based Algorithms: from single-objective to multi-objective optimization,University of Technology Sydney,2022-12-09,Iman Rahimi; Amir H. Gandomi; Fang Chen; Efrén Mezura‐Montes,Archives of Computational Methods in Engineering,105,Defense_Security
Half a century of rising extinction risk of coral reef sharks and rays,James Cook University,2023-01-17,C. Samantha Sherman; Colin A. Simpfendorfer; Nathan Pacoureau; Jay H. Matsushiba; Helen F. Yan,Nature Communications,103,Defense_Security
Determinants of life expectancy in most polluted countries: Exploring the effect of environmental degradation,University of Southern Queensland,2022-01-21,Mohammad Mafizur Rahman; Rezwanul Hasan Rana; Rasheda Khanam,PLoS ONE,100,Defense_Security
"European fitness landscape for children and adolescents: updated reference values, fitness maps and country rankings based on nearly 8 million test results from 34 countries gathered by the FitBack network",University of South Australia,2023-01-09,Francisco B. Ortega; Bojan Leskošek; Rok Blagus; José J. Gil‐Cosano; Jarek Mäestu,British Journal of Sports Medicine,99,Defense_Security
COVID-19 vaccine hesitancy among pregnant women: a systematic review and meta-analysis,Monash University,2022-08-01,Oashe Bhattacharya; Bodrun Naher Siddiquea; Aishwarya Shetty; Afroza Akhter; Baki Billah,BMJ Open,95,Defense_Security
