title,university,date,authors,journal,citations,theme
Corporates’ sustainability disclosures impact on cost of capital and idiosyncratic risk,University of Southern Queensland,2022-04-05,Amir Gholami; John Sands; Syed Shams,Meditari Accountancy Research,63,Advanced_Manufacturing
Spatial Correlation Network and Regional Differences for the Development of Digital Economy in China,Monash University,2021-11-25,Luyang Tang; Bangke Lu; Tianhai Tian,Entropy,62,Advanced_Manufacturing
The eye of the storm: a regular Kerr black hole,Victoria University of Wellington,2022-03-01,Alex Simpson; Matt Visser,Journal of Cosmology and Astroparticle Physics,61,Advanced_Manufacturing
Circular Economy in the Construction Industry: A Step towards Sustainable Development,University of Southern Queensland,2022-07-13,Maria Ghufran; Khurram Iqbal Ahmad Khan; Fahim Ullah; Abdur Rehman Nasir; Ahmad Aziz Alahmadi,Buildings,59,Advanced_Manufacturing
"The “Seafood” System: Aquatic Foods, Food Security, and the Global South",University of Otago,2022-06-01,Andreea L. Cojocaru; Yaqin Liu; Martin D. Smith; Wisdom Akpalu; Carlos Chávez,Review of Environmental Economics and Policy,56,Advanced_Manufacturing
"Participatory Governance of Smart Cities: Insights from e-Participation of Putrajaya and Petaling Jaya, Malaysia",Queensland University of Technology,2022-01-14,Seng Boon Lim; Tan Yiğitcanlar,Smart Cities,55,Advanced_Manufacturing
Buffer bots: The role of virtual service agents in mitigating negative effects when service fails,Swinburne University of Technology,2022-09-07,Sean Sands; Colin Campbell; Kirk Plangger; Leyland Pitt,Psychology and Marketing,54,Advanced_Manufacturing
Cooperative Target Tracking of Multiple Autonomous Surface Vehicles Under Switching Interaction Topologies,Swinburne University of Technology,2022-04-08,Lang Ma; Yu‐Long Wang; Qing‐Long Han,IEEE/CAA Journal of Automatica Sinica,53,Advanced_Manufacturing
Extrinsic and intrinsic motives: panic buying and impulsive buying during a pandemic,Griffith University,2022-10-24,Rambabu Lavuri; Deepak Jaiswal; Park Thaichon,International Journal of Retail & Distribution Management,53,Advanced_Manufacturing
Towards nutrient neutrality: A review of agricultural runoff mitigation strategies and the development of a decision-making framework,Griffith University,2023-02-22,Martin Jason Luna Juncal; Pietro Masino; Edoardo Bertone; Rodney A. Stewart,The Science of The Total Environment,53,Advanced_Manufacturing
"Total reward system, job satisfaction and employee productivity on company financial performance: evidence from Indonesian Generation Z workers",Edith Cowan University,2022-01-17,Josua Tarigan; Jordan Cahya; Albert Valentine; Saarce Elsye Hatane; Ferry Jie,Journal of Asia Business Studies,52,Advanced_Manufacturing
"Incentive Mechanisms for Smart Grid: State of the Art, Challenges, Open Issues, Future Directions",Charles Darwin University,2022-04-27,Sweta Bhattacharya; Rajeswari Chengoden; Gautam Srivastava; Mamoun Alazab; Abdul Rehman Javed,Big Data and Cognitive Computing,52,Advanced_Manufacturing
Resilience of Organizations in the Construction Industry in the Face of COVID-19 Disturbances: Dynamic Capabilities Perspective,Australian National University,2022-01-12,Ying‐Yi Chih; Cody Yu‐Ling Hsiao; Ali Zolghadr; Nader Naderpajouh,Journal of Management in Engineering,51,Advanced_Manufacturing
Effects of the energy transition on environmental impacts of cobalt supply: A prospective life cycle assessment study on future supply of cobalt,University of Technology Sydney,2022-04-05,Marc van der Meide; Carina Harpprecht; Stephen Northey; Yongxiang Yang; Bernhard Steubing,Journal of Industrial Ecology,51,Advanced_Manufacturing
Economic policy uncertainty and firm propensity to invest in corporate social responsibility,University of Otago,2022-09-16,Muhammad Ilyas; Rehman Uddin Mian; Muhammad Tahir Suleman,Management Decision,50,Advanced_Manufacturing
Field theory spin and momentum in water waves,Australian National University,2022-01-21,Konstantin Y. Bliokh; H. Punzmann; Hua Xia; Franco Nori; Michael Shats,Science Advances,49,Advanced_Manufacturing
Assessing Supply Chain Innovations for Building Resilient Food Supply Chains: An Emerging Economy Perspective,University of Technology Sydney,2023-03-09,S. K. Joshi; Manu Sharma; Banu Y. Ekren; Yiğit Kazançoğlu; Sunil Luthra,Sustainability,49,Advanced_Manufacturing
Consumers' preference for eco-friendly packaged products: pride vs guilt appeal,Curtin University,2022-10-07,Anwar Sadat Shimul; Isaac Cheah,Marketing Intelligence & Planning,48,Advanced_Manufacturing
The development trends of existing building energy conservation and emission reduction—A comprehensive review,University of Tasmania,2022-10-17,He Huang; Honglei Wang; Yujie Hu; Chengjiang Li; Xiaolin Wang,Energy Reports,48,Advanced_Manufacturing
The role of incentive mechanisms in promoting forest restoration,Queensland University of Technology,2022-11-14,Anazélia M. Tedesco; Pedro H. S. Brancalion; Michelle Hak Hepburn; Khalil Walji; Kerrie A. Wilson,Philosophical Transactions of the Royal Society B Biological Sciences,47,Advanced_Manufacturing
Direct discovery of the inner exoplanet in the HD 206893 system,Monash University,2022-12-15,Sasha Hinkley; S. Lacour; Gabriel-Dominique Marleau; A.‐M. Lagrange; Jason Wang,Astronomy and Astrophysics,47,Advanced_Manufacturing
Predicting Knee Joint Kinematics from Wearable Sensor Data in People with Knee Osteoarthritis and Clinical Considerations for Future Machine Learning Models,Curtin University,2022-01-07,Jay-Shian Tan; Sawitchaya Tippaya; Tara Binnie; Paul Davey; Kathryn Napier,Sensors,46,Advanced_Manufacturing
Pressure–Strain Interaction as the Energy Dissipation Estimate in Collisionless Plasma,Victoria University of Wellington,2022-04-01,Yan Yang; W. H. Matthaeus; Sohom Roy; V. Roytershteyn; T. N. Parashar,The Astrophysical Journal,46,Advanced_Manufacturing
Numerical simulation of a non-linear nanofluidic model to characterise the MHD chemically reactive flow past an inclined stretching surface,Monash University,2022-03-16,Sk. Reza‐E‐Rabbi; Md. Shakhaoath Khan; S. M. Arifuzzaman; Saiful Islam; Pronab Biswas,Partial Differential Equations in Applied Mathematics,45,Advanced_Manufacturing
Tuning particle inertial separation in sinusoidal channels by embedding periodic obstacle microstructures,Griffith University,2022-01-01,Haotian Cha; Hedieh Fallahi; Yuchen Dai; Sharda Yadav; Samith Hettiarachchi,Lab on a Chip,45,Advanced_Manufacturing
Examining the environmental aspect of economic complexity outlook and environmental-related technologies in the Nordic states,Torrens University Australia,2023-04-08,Andrew Adewale Alola; Ali Çeli̇k; Usama Awan; İbrahim Abdallah; Hephzibah Onyeje Obekpa,Journal of Cleaner Production,44,Advanced_Manufacturing
A new framework for electricity price forecasting via multi-head self-attention and CNN-based techniques in the competitive electricity market,Griffith University,2023-08-18,Alireza Pourdaryaei; Mohammad Mohammadi; Hamza Mubarak; Abdallah Abdellatif; Mazaher Karimi,Expert Systems with Applications,43,Advanced_Manufacturing
"Two-step deep learning framework with error compensation technique for short-term, half-hourly electricity price forecasting",University of Southern Queensland,2023-10-18,Sujan Ghimire; Ravinesh C. Deo; David Casillas-Pérez; Sancho Salcedo‐Sanz,Applied Energy,43,Advanced_Manufacturing
"Economics of renewable hydrogen production using wind and solar energy: A case study for Queensland, Australia",Griffith University,2023-12-30,Mostafa Rezaei; Alexandr Akimov; Evan Gray,Journal of Cleaner Production,40,Advanced_Manufacturing
Sustainable energy technologies for the Global South: challenges and solutions toward achieving SDG 7,Swinburne University of Technology,2023-01-01,Andrew Ng Kay Lup; Vikram Soni; Benjamin Keenan; Jaewon Son; Mohammad Ramezani Taghartapeh,Environmental Science Advances,38,Advanced_Manufacturing
"Innovation and inter-city knowledge spillovers: Social, geographical, and technological connectedness and psychological openness",Deakin University,2023-07-06,Martin Obschonka; Sam Tavassoli; Peter J. Rentfrow; Jeff Potter; Samuel D. Gosling,Research Policy,36,Advanced_Manufacturing
Joining Forces: The Spillover Effects of EPA Enforcement Actions and the Role of Socially Responsible Investors,Monash University,2023-02-24,Sudipto Dasgupta; Thanh Huynh; Ying Xia,Review of Financial Studies,35,Advanced_Manufacturing
"Energy justice, democracy and deforestation",Bond University,2023-05-05,Alex O. Acheampong; Eric Evans Osei Opoku,Journal of Environmental Management,35,Advanced_Manufacturing
Effectiveness of H5P in improving student learning outcomes in an online tertiary education setting,University of South Australia,2023-03-16,Tarosh Thomas Jacob; Stephanie Centofanti,Journal of Computing in Higher Education,34,Advanced_Manufacturing
Guidance on the use of complex systems models for economic evaluations of public health interventions,La Trobe University,2023-04-20,Penny Breeze; Hazel Squires; Kate Ennis; Petra Meier; Kate Hayes,Health Economics,33,Advanced_Manufacturing
Farmers’ organizations and sustainable development: An introduction,Lincoln University,2023-07-07,Wanglin Ma; Marco A. Marini; Dil Bahadur Rahut,Annals of public and co-operative economy,33,Advanced_Manufacturing
Secure Cooperative Path Following of Autonomous Surface Vehicles Under Cyber and Physical Attacks,Swinburne University of Technology,2023-04-25,Zhaoqing Liu; Xiaohua Ge; Qing‐Long Han; Yu‐Long Wang; Xian‐Ming Zhang,IEEE Transactions on Intelligent Vehicles,32,Advanced_Manufacturing
Testing parity symmetry of gravity with gravitational waves,Australian National University,2023-01-12,Jin Qiao; Zhao Li; Tao Zhu; Ran Ji; Guoliang Li,Frontiers in Astronomy and Space Sciences,31,Advanced_Manufacturing
Tackling grand societal challenges: Understanding when and how reverse engineering fosters frugal product innovation in an emerging market,Edith Cowan University,2023-05-19,Samuel Adomako; Michael Asiedu Gyensare; Joseph Amankwah‐Amoah; Pervaiz Akhtar; N. Hussain,Journal of Product Innovation Management,29,Advanced_Manufacturing
Inertia emulation control of PMSG-based wind turbines for enhanced grid stability in low inertia power systems,Swinburne University of Technology,2024-01-19,Asif Khan; D.A. Aragon; Mehdi Seyedmahmoudian; Saad Mekhilef; Alex Stojcevski,International Journal of Electrical Power & Energy Systems,24,Advanced_Manufacturing
Scarcity and quality risks for future global urban water supply,Deakin University,2024-01-29,Zhifeng Liu; Jiahe Ying; Chunyang He; Dongjie Guan; Xinhao Pan,Landscape Ecology,24,Advanced_Manufacturing
How much growth is required to achieve good lives for all? Insights from needs-based analysis,Macquarie University,2024-07-23,Jason Hickel; Dylan Sullivan,World Development Perspectives,24,Advanced_Manufacturing
Interparticle forces and their effects in particulate systems,Monash University,2024-01-23,Qijun Zheng; Runyu Yang; Qinghua Zeng; Haiping Zhu; Kejun Dong,Powder Technology,23,Advanced_Manufacturing
Techno-economics of offshore wind-based dynamic hydrogen production,Griffith University,2024-08-01,Mostafa Rezaei; Alexandr Akimov; Evan Gray,Applied Energy,23,Advanced_Manufacturing
Acceleration of phosphorus weathering under warm climates,University of Waikato,2024-07-10,Licheng Guo; Shangfa Xiong; Benjamin Mills; Terry T. Isson; Shiling Yang,Science Advances,21,Advanced_Manufacturing
Analysing multifaceted barriers to modular construction in sustainable building projects: a comprehensive evaluation using multi-criteria decision making,Monash University,2024-01-04,Ali Hassan Ali; Ahmed Farouk Kineber; Nehal Elshaboury; Mehrdad Arashpour; Ahmed Osama Daoud,International Journal of Construction Management,20,Advanced_Manufacturing
Does digitalization enhance the effects of lean production on social performance?,Swinburne University of Technology,2024-03-07,Roberto Chávez; Wantao Yu; Mark Jacobs; Chee Yew Wong,International Journal of Operations & Production Management,19,Advanced_Manufacturing
"A systematic literature review of attitudes, intentions and behaviours of teaching academics pertaining to AI and generative AI (GenAI) in higher education: An analysis of GenAI adoption using the UTAUT framework",University of Wollongong,2024-12-16,Sasha Nikolic; Isabelle Wentworth; Lynn Sheridan; Simon Moss; Elisabeth Duursma,Australasian Journal of Educational Technology,18,Advanced_Manufacturing
Fundamental and Second-Order Superregular Breathers in Vector Fields,Australian National University,2024-01-10,Chong Liu; Shaochun Chen; Nail Akhmediev,Physical Review Letters,17,Advanced_Manufacturing
"Visualising a framework for enhancing material circularity in building construction projects: Drivers, barriers, and strategies",Griffith University,2024-02-26,Isuri Amarasinghe; Ying Hong; Rodney A. Stewart,Building and Environment,17,Advanced_Manufacturing
Systematic challenges and opportunities in insect monitoring: a Global South perspective,James Cook University,2024-05-05,Melissa Sánchez Herrera; Dimitri Forero; Adolfo R. Calor; Gustavo Q. Romero; Muzafar Riyaz,Philosophical Transactions of the Royal Society B Biological Sciences,17,Advanced_Manufacturing
Localized wave structures: Solitons and beyond,University of Southern Queensland,2024-06-01,Lev A. Ostrovsky; Efim Pelinovsky; Victor I. Shrira; Yury Stepanyants,Chaos An Interdisciplinary Journal of Nonlinear Science,17,Advanced_Manufacturing
Nonlinear topological symmetry protection in a dissipative system,University of Auckland,2024-02-15,Stéphane Coen; Bruno Garbin; Gang Xu; Liam Quinn; Nathan Goldman,Nature Communications,16,Advanced_Manufacturing
Numerical study on perforation damage and fragmentation of reinforced concrete slab under close-in explosion,Curtin University,2024-01-20,Zitong Wang; Wensu Chen; Zhijie Huang; Hong Hao,Engineering Failure Analysis,16,Advanced_Manufacturing
Dynamic pricing in consumer-centric electricity markets: A systematic review and thematic analysis,University of Waikato,2024-03-01,Chin Hui Hao; Presley K. Wesseh; Jin Wang; Hermas Abudu; Kingsley E. Dogah,Energy Strategy Reviews,16,Advanced_Manufacturing
Taking steps toward healthy &amp; sustainable transport investment: A systematic review of economic evaluations in the academic literature on large-scale active transport infrastructure,Griffith University,2024-01-03,Madison Bland; Matthew Burke; Kelly Bertolaccini,International Journal of Sustainable Transportation,15,Advanced_Manufacturing
Agent-based simulation for pedestrian evacuation: A systematic literature review,University of Auckland,2024-08-02,G. Senanayake; Minh Kieu; Yang Zou; Kim N. Dirks,International Journal of Disaster Risk Reduction,15,Advanced_Manufacturing
Gamification for sustainable consumption: A state‐of‐the‐art overview and future agenda,Swinburne University of Technology,2024-11-22,Weng Marc Lim; Manish Das; Wamika Sharma; Aastha Verma; Rajeev Kumra,Business Strategy and the Environment,15,Advanced_Manufacturing
An Isolated Complex V Inefficiency and Dysregulated Mitochondrial Function in Immortalized Lymphocytes from ME/CFS Patients,La Trobe University,2020-02-06,Daniel Missailidis; Sarah J. Annesley; Claire Y. Allan; Oana Sanislav; Brett A. Lidbury,International Journal of Molecular Sciences,73,Advanced_Manufacturing
Multiagent Actor-Critic Network-Based Incentive Mechanism for Mobile Crowdsensing in Industrial Systems,Charles Darwin University,2020-09-21,Bo Gu; Xinxin Yang; Ziqi Lin; Weiwei Hu; Mamoun Alazab,IEEE Transactions on Industrial Informatics,73,Advanced_Manufacturing
Can entrepreneurial orientation improve sustainable development through leveraging internal lean practices?,Swinburne University of Technology,2020-03-12,Roberto Chávez; Wantao Yu; Muhammad Shakeel Sadiq Jajja; Antonio Lecuna; Brian Fynes,Business Strategy and the Environment,72,Advanced_Manufacturing
Farm machinery use and maize yields in China: an analysis accounting for selection bias and heterogeneity,Lincoln University,2020-07-24,Xiaoshi Zhou; Wanglin Ma; Gucheng Li; Huanguang Qiu,Australian Journal of Agricultural and Resource Economics,71,Advanced_Manufacturing
An Adaptive PV Frequency Control Strategy Based on Real-Time Inertia Estimation,Queensland University of Technology,2020-12-17,Yu Su; Hongyu Li; Yi Cui; Shutang You; Yiwei Ma,IEEE Transactions on Smart Grid,69,Advanced_Manufacturing
Design Considerations for Real-Time Collaboration with Creative Artificial Intelligence,Monash University,2020-03-04,Jon McCormack; Patrick Hutchings; Toby Gifford; Matthew Yee-King; Maria Teresa Llano,Organised Sound,66,Advanced_Manufacturing
Global Macroeconomic Scenarios of the COVID-19 Pandemic,Australian National University,2020-01-01,Warwick J. McKibbin; Roshen Fernando,SSRN Electronic Journal,66,Advanced_Manufacturing
GRVMP: A Greedy Randomized Algorithm for Virtual Machine Placement in Cloud Data Centers,Deakin University,2020-06-30,Sadoon Azizi; Mohammad Shojafar; Jemal Abawajy; Rajkumar Buyya,IEEE Systems Journal,66,Advanced_Manufacturing
Enablers and barriers to implementation of and compliance with school-based healthy food and beverage policies: a systematic literature review and meta-synthesis,Macquarie University,2020-04-22,Rimantė Ronto; Neha Rathi; Anthony Worsley; Taren Sanders; Chris Lonsdale,Public Health Nutrition,62,Advanced_Manufacturing
An Online Reinforcement Learning Approach for Dynamic Pricing of Electric Vehicle Charging Stations,Deakin University,2020-01-01,Valeh Moghaddam; Amirmehdi Yazdani; Hai Wang; David Parlevliet; Farhad Shahnia,IEEE Access,62,Advanced_Manufacturing
Impacts of cooperative membership on banana yield and risk exposure: Insights from China,Lincoln University,2021-11-24,Wanglin Ma; Hongyun Zheng; Peng Yuan,Journal of Agricultural Economics,60,Advanced_Manufacturing
A Short Survey of Pre-trained Language Models for Conversational AI-A New Age in NLP,Macquarie University,2020-01-30,Munazza Zaib; Quan Z. Sheng; Wei Emma Zhang,Proceedings of the Australasian Computer Science Week Multiconference,59,Advanced_Manufacturing
The impact of COVID-19 on the Chinese tourism industry,University of New England,2021-10-08,Can Wang; Samuel Meng; Mahinda Siriwardana; Tien Pham,Tourism Economics,59,Advanced_Manufacturing
Development and Validation of Artificial Neural Network-Based Tools for Forecasting of Power System Inertia With Wind Farms Penetration,Central Queensland University,2020-09-02,E.S.N. Raju P; Hesamoddin Marzooghi; James Yu; Vladimir Terzija,IEEE Systems Journal,58,Advanced_Manufacturing
Effects of cooperative membership on financial performance of banana farmers in China: A heterogeneous analysis,Lincoln University,2021-04-21,Wanglin Ma; Hongyun Zheng; Yueji Zhu; Jianling Qi,Annals of public and co-operative economy,58,Advanced_Manufacturing
Workplace digitalisation and work-nonwork satisfaction: the role of spillover social media,University of Tasmania,2020-02-17,Farveh Farivar; Julia Richardson,Behaviour and Information Technology,57,Advanced_Manufacturing
Federated Learning Meets Contract Theory: Economic-Efficiency Framework for Electric Vehicle Networks,University of Technology Sydney,2020-12-21,Yuris Mulya Saputra; Diep N. Nguyen; Dinh Thai Hoang; Thang X. Vu; Eryk Dutkiewicz,IEEE Transactions on Mobile Computing,57,Advanced_Manufacturing
Climate Change Adaptation Options for Coastal Communities and Local Governments,University of the Sunshine Coast,2020-01-07,Laura Sinay; Bill Carter,Climate,56,Advanced_Manufacturing
Waves that Appear From Nowhere: Complex Rogue Wave Structures and Their Elementary Particles,Australian National University,2021-01-15,Nail Akhmediev,Frontiers in Physics,56,Advanced_Manufacturing
GAN-Driven Personalized Spatial-Temporal Private Data Sharing in Cyber-Physical Social Systems,Deakin University,2020-06-09,Youyang Qu; Shui Yu; Wanlei Zhou; Yonghong Tian,IEEE Transactions on Network Science and Engineering,55,Advanced_Manufacturing
A Framework for Joint Scheduling and Power Trading of Prosumers in Transactive Markets,Monash University,2020-09-24,Mohsen Khorasany; Afshin Najafi-Ghalelou; Reza Razzaghi,IEEE Transactions on Sustainable Energy,55,Advanced_Manufacturing
Adoption of organic soil amendments and its impact on farm performance: evidence from wheat farmers in China*,Lincoln University,2020-12-27,Hongyun Zheng; Wanglin Ma; Gucheng Li,Australian Journal of Agricultural and Resource Economics,55,Advanced_Manufacturing
Evaluating cost function criteria in predicting healthy gait,Griffith University,2021-05-18,Kirsten Veerkamp; Niels Waterval; Thomas Geijtenbeek; Christopher P. Carty; David G. Lloyd,Journal of Biomechanics,54,Advanced_Manufacturing
Blockchain-Enabled Asynchronous Federated Learning in Edge Computing,Deakin University,2021-05-11,Yinghui Liu; Youyang Qu; Chenhao Xu; Zhicheng Hao; Bruce Gu,Sensors,53,Advanced_Manufacturing
A recovery planning model for online business operations under the COVID-19 outbreak,University of Technology Sydney,2021-09-17,Sanjoy Kumar Paul; Md. Abdul Moktadir; Karam M. Sallam; Tsan‐Ming Choi; Ripon K. Chakrabortty,International Journal of Production Research,53,Advanced_Manufacturing
DfMA: Towards an Integrated Strategy for a More Productive and Sustainable Construction Industry in Australia,Bond University,2021-08-17,Craig Langston; Weiwei Zhang,Sustainability,51,Advanced_Manufacturing
Big Data Applications the Banking Sector: A Bibliometric Analysis Approach,Curtin University,2021-10-01,Haitham Nobanee; Mehroz Nida Dilshad; Mona Al Dhanhani; Maitha Al Neyadi; Sultan Al Qubaisi,SAGE Open,50,Advanced_Manufacturing
Game Production Studies,Queensland University of Technology,2021-01-01,Olli Sotamaa; Jan Š Švelch; David B. Nieborg; Vinciane Zabban; Mia Consalvo,Amsterdam University Press eBooks,50,Advanced_Manufacturing
Effective regulations of FinTech innovations: the case of China,La Trobe University,2021-01-06,Ya Bu; Hui Li; Xiaoqing Wu,Economics of Innovation and New Technology,49,Advanced_Manufacturing
Estimation of Non-Synchronous Inertia in AC Microgrids,Monash University,2021-04-02,Chitaranjan Phurailatpam; Zakir Hussain Rather; Behrooz Bahrani; Suryanarayana Doolla,IEEE Transactions on Sustainable Energy,49,Advanced_Manufacturing
A review of systems modelling for local sustainability,Deakin University,2021-10-13,Enayat A. Moallemi; Edoardo Bertone; Sibel Eker; Lei Gao; Katrina Szetey,Environmental Research Letters,46,Advanced_Manufacturing
"Examining supply and demand of cooling effect of blue and green spaces in mitigating urban heat island effects: A case study of the Fujian Delta urban agglomeration (FDUA), China",University of Auckland,2022-07-27,Zhong-Jian Shen; Binghua Zhang; Ruhong Xin; Junyang Liu,Ecological Indicators,44,Advanced_Manufacturing
The economics of COVID-19: a systematic literature review,University of Southern Queensland,2022-09-15,I. W. Rathnayaka; Rasheda Khanam; Mohammad Mafizur Rahman,Journal of Economic Studies,44,Advanced_Manufacturing
A Narrative Review on the Collection and Use of Electronic Patient-Reported Outcomes in Cancer Survivorship Care with Emphasis on Symptom Monitoring,Flinders University,2022-06-17,Corina van den Hurk; Floortje Mols; Manuela Eicher; Raymond J. Chan; Annemarie Becker‐Commissaris,Current Oncology,43,Advanced_Manufacturing
Anti‐consumption behavior: A meta‐analytic integration of attitude behavior context theory and well‐being theory,Griffith University,2022-11-08,Haroon Iqbal Maseeh; Deepak Sangroya; Charles Jebarajakirthy; Mohd Adil; Jaspreet Kaur,Psychology and Marketing,43,Advanced_Manufacturing
Mixed Game-Based AoI Optimization for Combating COVID-19 With AI Bots,Charles Darwin University,2022-11-01,Yaoqi Yang; Weizheng Wang; Zhimeng Yin; Renhui Xu; Xiaokang Zhou,IEEE Journal on Selected Areas in Communications,43,Advanced_Manufacturing
Older Adults' Satisfaction with Telemedicine During the COVID-19 Pandemic: A Systematic Review,University of Otago,2022-05-25,Nabeel H. M. Alsabeeha; Momen A. Atieh; Melodena Stephens Balakrishnan,Telemedicine Journal and e-Health,41,Advanced_Manufacturing
Do capital markets reward corporate climate change actions? Evidence from the cost of debt,University of Otago,2022-11-23,Khurshid Ali; Muhammad Nadeem; Rakesh K. Pandey; Gurmeet S. Bhabra,Business Strategy and the Environment,41,Advanced_Manufacturing
Understanding travel behavior adjustment under COVID-19,Australian Catholic University,2022-05-24,Wenbin Yao; Jinqiang Yu; Ying Yang; Nuo Chen; Sheng Jin,Communications in Transportation Research,40,Advanced_Manufacturing
Silicon-based soft parallel robots 4D printing and multiphysics analysis,Deakin University,2022-10-04,Ali Zolfagharian; Saleh Gharaie; Abbas Z. Kouzani; Mohammad Lakhi; Sadegh Ranjbar,Smart Materials and Structures,40,Advanced_Manufacturing
Veracity-aware and Event-driven Personalized News Recommendation for Fake News Mitigation,Macquarie University,2022-04-25,Shoujin Wang; Xiaofei Xu; Xiuzhen Zhang; Yan Wang; Wenzhuo Song,Proceedings of the ACM Web Conference 2022,39,Advanced_Manufacturing
Can the marketization of urban land transfer improve energy efficiency?,Macquarie University,2022-12-23,Yanjun Yang; Rui Xue; Xiaoxi Zhang; Yutai Cheng; Yuli Shan,Journal of Environmental Management,38,Advanced_Manufacturing
The IntCal20 Northern Hemisphere Radiocarbon Age Calibration Curve (0–55 cal kBP),University of Waikato,2020-08-01,Paula Reimer; William E. N. Austin; Édouard Bard; Alex Bayliss; Paul G. Blackwell,Radiocarbon,6195,Marine_Naval
Scientists' warning on invasive alien species,Lincoln University,2020-06-25,Petr Pyšek; Philip E. Hulme; Daniel Simberloff; Sven Bacher; Tim M. Blackburn,Biological reviews/Biological reviews of the Cambridge Philosophical Society,1737,Marine_Naval
